{
  "schema": "archie-distill-profile/v1",
  "id": "qwen3-quality-local-v1",
  "claim_boundary": "This profile installs and executes a reproducible local teacher/student experiment. It does not admit intelligence or production readiness.",
  "teacher": {
    "repository": "Qwen/Qwen3-14B-GGUF",
    "revision": "c75e7b2d0234068f674a1bacf548ea32e27ccd29",
    "filename": "Qwen3-14B-Q4_K_M.gguf",
    "sha256": "500a8806e85ee9c83f3ae08420295592451379b4f8cf2d0f41c15dffeb6b81f0",
    "license": "Apache-2.0",
    "download_bytes": 9000000000
  },
  "student": {
    "repository": "Qwen/Qwen3-1.7B",
    "revision": "8d4744f9e13072f4920c326350fa81eedb74eae9",
    "license": "Apache-2.0",
    "download_bytes": 4080000000
  },
  "teacher_generation": {
    "context_size": 4096,
    "max_tokens": 768,
    "temperature": 0,
    "gpu_layers": 20
  },
  "training": {
    "seed": 446,
    "method": "qlora-sft",
    "epochs": 3,
    "learning_rate": 0.0002,
    "lora_rank": 16,
    "lora_alpha": 32,
    "holdout_rate": 0.2
  },
  "footprint": {
    "teacher_download_bytes": 9000000000,
    "student_download_bytes": 4080000000,
    "toolchain_download_bytes": 2000000000,
    "recommended_free_bytes": 69000000000,
    "recommended_system_memory_bytes": 24000000000,
    "recommended_gpu_vram_bytes": 12000000000
  }
}
